### ISSUE TITLE
SDN no route to host

### ISSUE THREAD

**Issue by xxwassyxx** [openshift/origin#14713]
[openshift-sdn-debug-2017-06-16.zip](https://github.com/openshift/origin/files/1081933/openshift-sdn-debug-2017-06-16.zip)
Basically the issue is this. The docker registry will be deployed on infra-node a as an example. None of the other infra-nodes appear to be able to reach it. I have tried various different things to try figure it out, but at the end of the day it appears to be a routing issue with the sdn.

I am able to nc across nodes just fine, even hitting the udp port openshift uses on the node ip's without issue. I have checked over the routing tables over and over but still no luck.
haproxy router is running on all 3 nodes, only the node that has the docker registry is working fin, the other 2 report no route to host. I relaise this isnt an issue with the docker registry per say but specifically with the sdn.

I have googled this issue and found a few github similar cases, but not been able to resolve this

##### Version
```
oc version
oc v1.4.1
kubernetes v1.4.0+776c994
features: Basic-Auth GSSAPI Kerberos SPNEGO

Server https://master-int.west.aws.openshift.bestbuy.com
openshift v1.4.1
kubernetes v1.4.0+776c994
```
##### Steps To Reproduce
1. build a cluster in AWS
2. run ansible playbook
3. curl -kv https://192.168.185.164:5000/healthz
4. curl -kv https://10.129.0.4:5000/healthz

##### Current Result
no route to host when trying to curl the registry on either pod ip or service ip

##### Expected Result
a 200 result

##### Additional Information
for some clarity of the network and to give a better picture. I have the following setup in AWS
##############################################
OpenShift Infra - 172.29.246.150 
OpenShift Infra - 172.29.247.10  
OpenShift Infra - 172.29.247.150 
OpenShift Master - 172.29.244.200
OpenShift Master - 172.29.245.10 
OpenShift Master - 172.29.245.70 
OpenShift Node - 172.29.245.150  
OpenShift Node - 172.29.245.200  
OpenShift Node - 172.29.246.10   
##############################################
oc get hostsubnet
```
name                           host
ip-172-29-244-200.us-west-2   ip-172-29-244-200.us-west-2   172.29.244.200   10.131.2.0/23
ip-172-29-245-10.us-west-2    ip-172-29-245-10.us-west-2    172.29.245.10    10.128.4.0/23
ip-172-29-245-150.us-west-2   ip-172-29-245-150.us-west-2   172.29.245.150   10.131.0.0/23
ip-172-29-245-200.us-west-2   ip-172-29-245-200.us-west-2   172.29.245.200   10.128.0.0/23
ip-172-29-245-70.us-west-2    ip-172-29-245-70.us-west-2    172.29.245.70    10.130.2.0/23
ip-172-29-246-10.us-west-2    ip-172-29-246-10.us-west-2    172.29.246.10    10.129.2.0/23
ip-172-29-246-150.us-west-2   ip-172-29-246-150.us-west-2   172.29.246.150   10.128.2.0/23
ip-172-29-247-10.us-west-2    ip-172-29-247-10.us-west-2    172.29.247.10    10.129.0.0/23
ip-172-29-247-150.us-west-2   ip-172-29-247-150.us-west-2   172.29.247.150   10.130.0.0/23
```
##############################################
From the master
route -n
```
Kernel IP routing table
Destination     Gateway         Genmask         Flags Metric Ref    Use Iface
0.0.0.0         172.29.244.193  0.0.0.0         UG    100    0        0 eth0
10.128.0.0      0.0.0.0         255.252.0.0     U     0      0        0 tun0
172.17.0.0      0.0.0.0         255.255.0.0     U     0      0        0 docker0
172.29.244.192  0.0.0.0         255.255.255.192 U     100    0        0 eth0
192.168.0.0     0.0.0.0         255.255.0.0     U     0      0        0 tun0
```
from an infra node
route -n
```
Kernel IP routing table
Destination     Gateway         Genmask         Flags Metric Ref    Use Iface
0.0.0.0         172.29.246.129  0.0.0.0         UG    100    0        0 eth0
10.128.0.0      0.0.0.0         255.252.0.0     U     0      0        0 tun0
172.17.0.0      0.0.0.0         255.255.0.0     U     0      0        0 docker0
172.29.246.128  0.0.0.0         255.255.255.128 U     100    0        0 eth0
192.168.0.0     0.0.0.0         255.255.0.0     U     0      0        0 tun0
```
##############################################
ovs flow from master
ovs-ofctl -O OpenFlow13 dump-flows br0
```
OFPST_FLOW reply (OF1.3) (xid=0x2):
 cookie=0x0, duration=4143.673s, table=0, n_packets=0, n_bytes=0, priority=200,arp,in_port=1,arp_spa=10.128.0.0/14,arp_tpa=10.131.2.0/23 actions=move:NXM_NX_TUN_ID[0..31]->NXM_NX_REG0[],goto_table:1
 cookie=0x0, duration=4143.669s, table=0, n_packets=0, n_bytes=0, priority=200,ip,in_port=1,nw_src=10.128.0.0/14,nw_dst=10.131.2.0/23 actions=move:NXM_NX_TUN_ID[0..31]->NXM_NX_REG0[],goto_table:1
 cookie=0x0, duration=4143.660s, table=0, n_packets=0, n_bytes=0, priority=200,arp,in_port=2,arp_spa=10.131.2.1,arp_tpa=10.128.0.0/14 actions=goto_table:5
 cookie=0x0, duration=4143.656s, table=0, n_packets=0, n_bytes=0, priority=200,ip,in_port=2 actions=goto_table:5
 cookie=0x0, duration=4143.665s, table=0, n_packets=0, n_bytes=0, priority=150,in_port=1 actions=drop
 cookie=0x0, duration=4143.651s, table=0, n_packets=8, n_bytes=648, priority=150,in_port=2 actions=drop
 cookie=0x0, duration=4143.647s, table=0, n_packets=0, n_bytes=0, priority=100,arp actions=goto_table:2
 cookie=0x0, duration=4143.643s, table=0, n_packets=0, n_bytes=0, priority=100,ip actions=goto_table:2
 cookie=0x0, duration=4143.639s, table=0, n_packets=0, n_bytes=0, priority=0 actions=drop
 cookie=0x0, duration=4143.506s, table=1, n_packets=0, n_bytes=0, priority=100,tun_src=172.29.245.10 actions=goto_table:5
 cookie=0x0, duration=4143.485s, table=1, n_packets=0, n_bytes=0, priority=100,tun_src=172.29.245.70 actions=goto_table:5
 cookie=0x0, duration=4143.459s, table=1, n_packets=0, n_bytes=0, priority=100,tun_src=172.29.247.10 actions=goto_table:5
 cookie=0x0, duration=4143.414s, table=1, n_packets=0, n_bytes=0, priority=100,tun_src=172.29.245.200 actions=goto_table:5
 cookie=0x0, duration=4143.396s, table=1, n_packets=0, n_bytes=0, priority=100,tun_src=172.29.246.10 actions=goto_table:5
 cookie=0x0, duration=4143.375s, table=1, n_packets=0, n_bytes=0, priority=100,tun_src=172.29.246.150 actions=goto_table:5
 cookie=0x0, duration=4143.356s, table=1, n_packets=0, n_bytes=0, priority=100,tun_src=172.29.247.150 actions=goto_table:5
 cookie=0x0, duration=4143.317s, table=1, n_packets=0, n_bytes=0, priority=100,tun_src=172.29.245.150 actions=goto_table:5
 cookie=0x0, duration=4143.636s, table=1, n_packets=0, n_bytes=0, priority=0 actions=drop
 cookie=0x0, duration=4143.633s, table=2, n_packets=0, n_bytes=0, priority=0 actions=drop
 cookie=0x0, duration=4143.629s, table=3, n_packets=0, n_bytes=0, priority=100,ip,nw_dst=192.168.0.0/16 actions=goto_table:4
 cookie=0x0, duration=4143.625s, table=3, n_packets=0, n_bytes=0, priority=0 actions=goto_table:5
 cookie=0x0, duration=4143.617s, table=4, n_packets=0, n_bytes=0, priority=200,reg0=0 actions=output:2
 cookie=0x0, duration=4143.467s, table=4, n_packets=0, n_bytes=0, priority=100,tcp,nw_dst=192.168.131.84,tp_dst=80 actions=output:2
 cookie=0x0, duration=4143.463s, table=4, n_packets=0, n_bytes=0, priority=100,tcp,nw_dst=192.168.131.84,tp_dst=443 actions=output:2
 cookie=0x0, duration=4143.458s, table=4, n_packets=0, n_bytes=0, priority=100,tcp,nw_dst=192.168.131.84,tp_dst=1936 actions=output:2
 cookie=0x0, duration=4143.454s, table=4, n_packets=0, n_bytes=0, priority=100,tcp,nw_dst=192.168.185.164,tp_dst=5000 actions=output:2
 cookie=0x0, duration=4143.443s, table=4, n_packets=0, n_bytes=0, priority=100,tcp,nw_dst=192.168.0.1,tp_dst=443 actions=output:2
 cookie=0x0, duration=4143.429s, table=4, n_packets=0, n_bytes=0, priority=100,udp,nw_dst=192.168.0.1,tp_dst=53 actions=output:2
 cookie=0x0, duration=4143.422s, table=4, n_packets=0, n_bytes=0, priority=100,tcp,nw_dst=192.168.0.1,tp_dst=53 actions=output:2
 cookie=0x0, duration=4143.613s, table=4, n_packets=0, n_bytes=0, priority=0 actions=drop
 cookie=0x0, duration=4143.610s, table=5, n_packets=0, n_bytes=0, priority=300,arp,arp_tpa=10.131.2.1 actions=output:2
 cookie=0x0, duration=4143.600s, table=5, n_packets=0, n_bytes=0, priority=300,ip,nw_dst=10.131.2.1 actions=output:2
 cookie=0x0, duration=4143.595s, table=5, n_packets=0, n_bytes=0, priority=200,arp,arp_tpa=10.131.2.0/23 actions=goto_table:6
 cookie=0x0, duration=4143.587s, table=5, n_packets=0, n_bytes=0, priority=200,ip,nw_dst=10.131.2.0/23 actions=goto_table:7
 cookie=0x0, duration=4143.582s, table=5, n_packets=0, n_bytes=0, priority=100,arp,arp_tpa=10.128.0.0/14 actions=goto_table:8
 cookie=0x0, duration=4143.577s, table=5, n_packets=0, n_bytes=0, priority=100,ip,nw_dst=10.128.0.0/14 actions=goto_table:8
 cookie=0x0, duration=4143.572s, table=5, n_packets=0, n_bytes=0, priority=0,ip actions=goto_table:9
 cookie=0x0, duration=4143.557s, table=5, n_packets=0, n_bytes=0, priority=0,arp actions=drop
 cookie=0x0, duration=4143.553s, table=6, n_packets=0, n_bytes=0, priority=0 actions=drop
 cookie=0x0, duration=4143.548s, table=7, n_packets=0, n_bytes=0, priority=0 actions=drop
 cookie=0x0, duration=4143.494s, table=8, n_packets=0, n_bytes=0, priority=100,arp,arp_tpa=10.128.4.0/23 actions=move:NXM_NX_REG0[]->NXM_NX_TUN_ID[0..31],set_field:172.29.245.10->tun_dst,output:1
 cookie=0x0, duration=4143.490s, table=8, n_packets=0, n_bytes=0, priority=100,ip,nw_dst=10.128.4.0/23 actions=move:NXM_NX_REG0[]->NXM_NX_TUN_ID[0..31],set_field:172.29.245.10->tun_dst,output:1
 cookie=0x0, duration=4143.472s, table=8, n_packets=0, n_bytes=0, priority=100,arp,arp_tpa=10.130.2.0/23 actions=move:NXM_NX_REG0[]->NXM_NX_TUN_ID[0..31],set_field:172.29.245.70->tun_dst,output:1
 cookie=0x0, duration=4143.467s, table=8, n_packets=0, n_bytes=0, priority=100,ip,nw_dst=10.130.2.0/23 actions=move:NXM_NX_REG0[]->NXM_NX_TUN_ID[0..31],set_field:172.29.245.70->tun_dst,output:1
 cookie=0x0, duration=4143.428s, table=8, n_packets=0, n_bytes=0, priority=100,arp,arp_tpa=10.129.0.0/23 actions=move:NXM_NX_REG0[]->NXM_NX_TUN_ID[0..31],set_field:172.29.247.10->tun_dst,output:1
 cookie=0x0, duration=4143.421s, table=8, n_packets=0, n_bytes=0, priority=100,ip,nw_dst=10.129.0.0/23 actions=move:NXM_NX_REG0[]->NXM_NX_TUN_ID[0..31],set_field:172.29.247.10->tun_dst,output:1
 cookie=0x0, duration=4143.410s, table=8, n_packets=0, n_bytes=0, priority=100,arp,arp_tpa=10.128.0.0/23 actions=move:NXM_NX_REG0[]->NXM_NX_TUN_ID[0..31],set_field:172.29.245.200->tun_dst,output:1
 cookie=0x0, duration=4143.404s, table=8, n_packets=0, n_bytes=0, priority=100,ip,nw_dst=10.128.0.0/23 actions=move:NXM_NX_REG0[]->NXM_NX_TUN_ID[0..31],set_field:172.29.245.200->tun_dst,output:1
 cookie=0x0, duration=4143.386s, table=8, n_packets=0, n_bytes=0, priority=100,arp,arp_tpa=10.129.2.0/23 actions=move:NXM_NX_REG0[]->NXM_NX_TUN_ID[0..31],set_field:172.29.246.10->tun_dst,output:1
 cookie=0x0, duration=4143.380s, table=8, n_packets=0, n_bytes=0, priority=100,ip,nw_dst=10.129.2.0/23 actions=move:NXM_NX_REG0[]->NXM_NX_TUN_ID[0..31],set_field:172.29.246.10->tun_dst,output:1
 cookie=0x0, duration=4143.367s, table=8, n_packets=0, n_bytes=0, priority=100,arp,arp_tpa=10.128.2.0/23 actions=move:NXM_NX_REG0[]->NXM_NX_TUN_ID[0..31],set_field:172.29.246.150->tun_dst,output:1
 cookie=0x0, duration=4143.362s, table=8, n_packets=0, n_bytes=0, priority=100,ip,nw_dst=10.128.2.0/23 actions=move:NXM_NX_REG0[]->NXM_NX_TUN_ID[0..31],set_field:172.29.246.150->tun_dst,output:1
 cookie=0x0, duration=4143.348s, table=8, n_packets=0, n_bytes=0, priority=100,arp,arp_tpa=10.130.0.0/23 actions=move:NXM_NX_REG0[]->NXM_NX_TUN_ID[0..31],set_field:172.29.247.150->tun_dst,output:1
 cookie=0x0, duration=4143.342s, table=8, n_packets=0, n_bytes=0, priority=100,ip,nw_dst=10.130.0.0/23 actions=move:NXM_NX_REG0[]->NXM_NX_TUN_ID[0..31],set_field:172.29.247.150->tun_dst,output:1
 cookie=0x0, duration=4143.313s, table=8, n_packets=0, n_bytes=0, priority=100,arp,arp_tpa=10.131.0.0/23 actions=move:NXM_NX_REG0[]->NXM_NX_TUN_ID[0..31],set_field:172.29.245.150->tun_dst,output:1
 cookie=0x0, duration=4143.300s, table=8, n_packets=0, n_bytes=0, priority=100,ip,nw_dst=10.131.0.0/23 actions=move:NXM_NX_REG0[]->NXM_NX_TUN_ID[0..31],set_field:172.29.245.150->tun_dst,output:1
 cookie=0x0, duration=4143.544s, table=8, n_packets=0, n_bytes=0, priority=0 actions=drop
 cookie=0x0, duration=4143.540s, table=9, n_packets=0, n_bytes=0, priority=0 actions=output:2
 cookie=0x0, duration=4143.521s, table=253, n_packets=0, n_bytes=0, actions=note:01.01.00.00.00.00
```
######################################################
iptables -t nat -L
```
Kernel IP routing table
Destination     Gateway         Genmask         Flags Metric Ref    Use Iface
0.0.0.0         172.29.246.129  0.0.0.0         UG    100    0        0 eth0
10.128.0.0      0.0.0.0         255.252.0.0     U     0      0        0 tun0
172.17.0.0      0.0.0.0         255.255.0.0     U     0      0        0 docker0
172.29.246.128  0.0.0.0         255.255.255.128 U     100    0        0 eth0
192.168.0.0     0.0.0.0         255.255.0.0     U     0      0        0 tun0
[root@ip-172-29-246-150 wpaul]# iptables -L -n
Chain INPUT (policy ACCEPT)
target     prot opt source               destination
KUBE-NODEPORT-NON-LOCAL  all  --  0.0.0.0/0            0.0.0.0/0            /* Ensure that non-local NodePort traffic can flow */
KUBE-FIREWALL  all  --  0.0.0.0/0            0.0.0.0/0
ACCEPT     all  --  0.0.0.0/0            0.0.0.0/0            /* traffic from docker */
ACCEPT     all  --  0.0.0.0/0            0.0.0.0/0            /* traffic from SDN */
ACCEPT     udp  --  0.0.0.0/0            0.0.0.0/0            multiport dports 4789 /* 001 vxlan incoming */
OS_FIREWALL_ALLOW  all  --  0.0.0.0/0            0.0.0.0/0

Chain FORWARD (policy ACCEPT)
target     prot opt source               destination
DOCKER-ISOLATION  all  --  0.0.0.0/0            0.0.0.0/0
DOCKER     all  --  0.0.0.0/0            0.0.0.0/0
ACCEPT     all  --  0.0.0.0/0            0.0.0.0/0            ctstate RELATED,ESTABLISHED
ACCEPT     all  --  0.0.0.0/0            0.0.0.0/0
ACCEPT     all  --  0.0.0.0/0            0.0.0.0/0
ACCEPT     all  --  10.128.0.0/14        0.0.0.0/0
ACCEPT     all  --  0.0.0.0/0            10.128.0.0/14

Chain OUTPUT (policy ACCEPT)
target     prot opt source               destination
KUBE-SERVICES  all  --  0.0.0.0/0            0.0.0.0/0            /* kubernetes service portals */
KUBE-FIREWALL  all  --  0.0.0.0/0            0.0.0.0/0

Chain DOCKER (1 references)
target     prot opt source               destination

Chain DOCKER-ISOLATION (1 references)
target     prot opt source               destination
RETURN     all  --  0.0.0.0/0            0.0.0.0/0

Chain KUBE-FIREWALL (2 references)
target     prot opt source               destination
DROP       all  --  0.0.0.0/0            0.0.0.0/0            /* kubernetes firewall for dropping marked packets */ mark match 0x8000/0x8000

Chain KUBE-NODEPORT-NON-LOCAL (1 references)
target     prot opt source               destination

Chain KUBE-SERVICES (1 references)
target     prot opt source               destination

Chain OS_FIREWALL_ALLOW (1 references)
target     prot opt source               destination
ACCEPT     tcp  --  0.0.0.0/0            0.0.0.0/0            state NEW tcp dpt:1936
ACCEPT     tcp  --  0.0.0.0/0            0.0.0.0/0            state NEW tcp dpt:1937
ACCEPT     tcp  --  0.0.0.0/0            0.0.0.0/0            state NEW tcp dpt:1938
ACCEPT     tcp  --  0.0.0.0/0            0.0.0.0/0            state NEW tcp dpt:1939
ACCEPT     tcp  --  0.0.0.0/0            0.0.0.0/0            state NEW tcp dpt:444
ACCEPT     tcp  --  0.0.0.0/0            0.0.0.0/0            state NEW tcp dpt:445
ACCEPT     tcp  --  0.0.0.0/0            0.0.0.0/0            state NEW tcp dpt:446
ACCEPT     tcp  --  0.0.0.0/0            0.0.0.0/0            state NEW tcp dpt:81
ACCEPT     tcp  --  0.0.0.0/0            0.0.0.0/0            state NEW tcp dpt:82
ACCEPT     tcp  --  0.0.0.0/0            0.0.0.0/0            state NEW tcp dpt:83
ACCEPT     tcp  --  0.0.0.0/0            0.0.0.0/0            state NEW tcp dpt:9100
ACCEPT     tcp  --  0.0.0.0/0            0.0.0.0/0            state NEW tcp dpt:9107
ACCEPT     tcp  --  0.0.0.0/0            0.0.0.0/0            state NEW tcp dpt:10250
ACCEPT     tcp  --  0.0.0.0/0            0.0.0.0/0            state NEW tcp dpt:80
ACCEPT     tcp  --  0.0.0.0/0            0.0.0.0/0            state NEW tcp dpt:443
ACCEPT     tcp  --  0.0.0.0/0            0.0.0.0/0            state NEW tcp dpt:10255
ACCEPT     udp  --  0.0.0.0/0            0.0.0.0/0            state NEW udp dpt:10255
ACCEPT     udp  --  0.0.0.0/0            0.0.0.0/0            state NEW udp dpt:4789
```
######################################################
```
Chain PREROUTING (policy ACCEPT)
target     prot opt source               destination
KUBE-HOSTPORTS  all  --  anywhere             anywhere             /* kube hostport portals */ ADDRTYPE match dst-type LOCAL
KUBE-PORTALS-CONTAINER  all  --  anywhere             anywhere             /* handle ClusterIPs; NOTE: this must be before the NodePort rules */
KUBE-SERVICES  all  --  anywhere             anywhere             /* kubernetes service portals */
DOCKER     all  --  anywhere             anywhere             ADDRTYPE match dst-type LOCAL
KUBE-NODEPORT-CONTAINER  all  --  anywhere             anywhere             ADDRTYPE match dst-type LOCAL /* handle service NodePorts; NOTE: this must be the last rule in the chain */

Chain INPUT (policy ACCEPT)
target     prot opt source               destination

Chain OUTPUT (policy ACCEPT)
target     prot opt source               destination
KUBE-HOSTPORTS  all  --  anywhere             anywhere             /* kube hostport portals */ ADDRTYPE match dst-type LOCAL
KUBE-PORTALS-HOST  all  --  anywhere             anywhere             /* handle ClusterIPs; NOTE: this must be before the NodePort rules */
KUBE-SERVICES  all  --  anywhere             anywhere             /* kubernetes service portals */
DOCKER     all  --  anywhere            !loopback/8           ADDRTYPE match dst-type LOCAL
KUBE-NODEPORT-HOST  all  --  anywhere             anywhere             ADDRTYPE match dst-type LOCAL /* handle service NodePorts; NOTE: this must be the last rule in the chain */

Chain POSTROUTING (policy ACCEPT)
target     prot opt source               destination
MASQUERADE  all  --  ip-172-17-0-0.us-west-2.compute.internal/16  anywhere
KUBE-POSTROUTING  all  --  anywhere             anywhere             /* kubernetes postrouting rules */
MASQUERADE  all  --  ip-10-128-0-0.us-west-2.compute.internal/14  anywhere
MASQUERADE  all  --  loopback/8           anywhere             /* SNAT for localhost access to hostports */

Chain DOCKER (2 references)
target     prot opt source               destination
RETURN     all  --  anywhere             anywhere

Chain KUBE-HOSTPORTS (2 references)
target     prot opt source               destination

Chain KUBE-MARK-DROP (0 references)
target     prot opt source               destination
MARK       all  --  anywhere             anywhere             MARK or 0x8000

Chain KUBE-MARK-MASQ (19 references)
target     prot opt source               destination
MARK       all  --  anywhere             anywhere             MARK or 0x4000

Chain KUBE-NODEPORT-CONTAINER (1 references)
target     prot opt source               destination

Chain KUBE-NODEPORT-HOST (1 references)
target     prot opt source               destination

Chain KUBE-NODEPORTS (1 references)
target     prot opt source               destination

Chain KUBE-PORTALS-CONTAINER (1 references)
target     prot opt source               destination

Chain KUBE-PORTALS-HOST (1 references)
target     prot opt source               destination

Chain KUBE-POSTROUTING (1 references)
target     prot opt source               destination
MASQUERADE  all  --  anywhere             anywhere             /* kubernetes service traffic requiring SNAT */ mark match 0x4000/0x4000

Chain KUBE-SEP-6X4724UNGY2RWB6P (1 references)
target     prot opt source               destination
KUBE-MARK-MASQ  all  --  ip-172-29-247-10.us-west-2.compute.internal  anywhere             /* default/router:443-tcp */
DNAT       tcp  --  anywhere             anywhere             /* default/router:443-tcp */ tcp to:172.29.247.10:443

Chain KUBE-SEP-BDR254MFJVTUOIYH (2 references)
target     prot opt source               destination
KUBE-MARK-MASQ  all  --  ip-172-29-244-200.us-west-2.compute.internal  anywhere             /* default/kubernetes:https */
DNAT       tcp  --  anywhere             anywhere             /* default/kubernetes:https */ recent: SET name: KUBE-SEP-BDR254MFJVTUOIYH side: source mask: 255.255.255.255 tcp to:172.29.244.200:443

Chain KUBE-SEP-BSCAUFMAF3NDXQD7 (1 references)
target     prot opt source               destination
KUBE-MARK-MASQ  all  --  ip-172-29-247-150.us-west-2.compute.internal  anywhere             /* default/router:80-tcp */
DNAT       tcp  --  anywhere             anywhere             /* default/router:80-tcp */ tcp to:172.29.247.150:80

Chain KUBE-SEP-CMBITXRDYAFP2SEQ (1 references)
target     prot opt source               destination
KUBE-MARK-MASQ  all  --  ip-172-29-247-10.us-west-2.compute.internal  anywhere             /* default/router:80-tcp */
DNAT       tcp  --  anywhere             anywhere             /* default/router:80-tcp */ tcp to:172.29.247.10:80

Chain KUBE-SEP-FYJ6WLFNFEAB7O3Q (1 references)
target     prot opt source               destination
KUBE-MARK-MASQ  all  --  ip-172-29-247-10.us-west-2.compute.internal  anywhere             /* default/router:1936-tcp */
DNAT       tcp  --  anywhere             anywhere             /* default/router:1936-tcp */ tcp to:172.29.247.10:1936

Chain KUBE-SEP-GF3KZOOMRL5JX7AC (1 references)
target     prot opt source               destination
KUBE-MARK-MASQ  all  --  ip-172-29-247-150.us-west-2.compute.internal  anywhere             /* default/router:443-tcp */
DNAT       tcp  --  anywhere             anywhere             /* default/router:443-tcp */ tcp to:172.29.247.150:443

Chain KUBE-SEP-IXIDMSKLF33PGFQD (1 references)
target     prot opt source               destination
KUBE-MARK-MASQ  all  --  ip-172-29-247-150.us-west-2.compute.internal  anywhere             /* default/router:1936-tcp */
DNAT       tcp  --  anywhere             anywhere             /* default/router:1936-tcp */ tcp to:172.29.247.150:1936

Chain KUBE-SEP-J6XRA6J4L6J6DN7P (2 references)
target     prot opt source               destination
KUBE-MARK-MASQ  all  --  ip-172-29-245-10.us-west-2.compute.internal  anywhere             /* default/kubernetes:https */
DNAT       tcp  --  anywhere             anywhere             /* default/kubernetes:https */ recent: SET name: KUBE-SEP-J6XRA6J4L6J6DN7P side: source mask: 255.255.255.255 tcp to:172.29.245.10:443

Chain KUBE-SEP-MMFG5XZSCW3A7WLN (1 references)
target     prot opt source               destination
KUBE-MARK-MASQ  all  --  ip-172-29-246-150.us-west-2.compute.internal  anywhere             /* default/router:1936-tcp */
DNAT       tcp  --  anywhere             anywhere             /* default/router:1936-tcp */ tcp to:172.29.246.150:1936

Chain KUBE-SEP-MYMUKV3LVCJ5D7KK (1 references)
target     prot opt source               destination
KUBE-MARK-MASQ  all  --  ip-172-29-246-150.us-west-2.compute.internal  anywhere             /* default/router:443-tcp */
DNAT       tcp  --  anywhere             anywhere             /* default/router:443-tcp */ tcp to:172.29.246.150:443

Chain KUBE-SEP-NALPWJLJVSZNTJRD (2 references)
target     prot opt source               destination
KUBE-MARK-MASQ  all  --  ip-172-29-245-70.us-west-2.compute.internal  anywhere             /* default/kubernetes:dns */
DNAT       udp  --  anywhere             anywhere             /* default/kubernetes:dns */ recent: SET name: KUBE-SEP-NALPWJLJVSZNTJRD side: source mask: 255.255.255.255 udp to:172.29.245.70:8053

Chain KUBE-SEP-NPQ2VIAEH3BD3ESR (2 references)
target     prot opt source               destination
KUBE-MARK-MASQ  all  --  ip-172-29-244-200.us-west-2.compute.internal  anywhere             /* default/kubernetes:dns-tcp */
DNAT       tcp  --  anywhere             anywhere             /* default/kubernetes:dns-tcp */ recent: SET name: KUBE-SEP-NPQ2VIAEH3BD3ESR side: source mask: 255.255.255.255 tcp to:172.29.244.200:8053

Chain KUBE-SEP-O5ROI2O3K6SCVUFM (2 references)
target     prot opt source               destination
KUBE-MARK-MASQ  all  --  ip-10-128-2-4.us-west-2.compute.internal  anywhere             /* default/docker-registry:5000-tcp */
DNAT       tcp  --  anywhere             anywhere             /* default/docker-registry:5000-tcp */ recent: SET name: KUBE-SEP-O5ROI2O3K6SCVUFM side: source mask: 255.255.255.255 tcp to:10.128.2.4:5000

Chain KUBE-SEP-PXYIPIRGKMCKHQQ6 (2 references)
target     prot opt source               destination
KUBE-MARK-MASQ  all  --  ip-172-29-245-10.us-west-2.compute.internal  anywhere             /* default/kubernetes:dns */
DNAT       udp  --  anywhere             anywhere             /* default/kubernetes:dns */ recent: SET name: KUBE-SEP-PXYIPIRGKMCKHQQ6 side: source mask: 255.255.255.255 udp to:172.29.245.10:8053

Chain KUBE-SEP-R2XQMTWJG4WFM36Q (2 references)
target     prot opt source               destination
KUBE-MARK-MASQ  all  --  ip-172-29-244-200.us-west-2.compute.internal  anywhere             /* default/kubernetes:dns */
DNAT       udp  --  anywhere             anywhere             /* default/kubernetes:dns */ recent: SET name: KUBE-SEP-R2XQMTWJG4WFM36Q side: source mask: 255.255.255.255 udp to:172.29.244.200:8053

Chain KUBE-SEP-SDV4BXWKC6E2WZAP (2 references)
target     prot opt source               destination
KUBE-MARK-MASQ  all  --  ip-172-29-245-10.us-west-2.compute.internal  anywhere             /* default/kubernetes:dns-tcp */
DNAT       tcp  --  anywhere             anywhere             /* default/kubernetes:dns-tcp */ recent: SET name: KUBE-SEP-SDV4BXWKC6E2WZAP side: source mask: 255.255.255.255 tcp to:172.29.245.10:8053

Chain KUBE-SEP-T4RPTTFRMYR2YTCF (1 references)
target     prot opt source               destination
KUBE-MARK-MASQ  all  --  ip-172-29-246-150.us-west-2.compute.internal  anywhere             /* default/router:80-tcp */
DNAT       tcp  --  anywhere             anywhere             /* default/router:80-tcp */ tcp to:172.29.246.150:80

Chain KUBE-SEP-V7MSHVHABU7ZBXRH (2 references)
target     prot opt source               destination
KUBE-MARK-MASQ  all  --  ip-172-29-245-70.us-west-2.compute.internal  anywhere             /* default/kubernetes:https */
DNAT       tcp  --  anywhere             anywhere             /* default/kubernetes:https */ recent: SET name: KUBE-SEP-V7MSHVHABU7ZBXRH side: source mask: 255.255.255.255 tcp to:172.29.245.70:443

Chain KUBE-SEP-YWHP6BFRXNFGEHLX (2 references)
target     prot opt source               destination
KUBE-MARK-MASQ  all  --  ip-172-29-245-70.us-west-2.compute.internal  anywhere             /* default/kubernetes:dns-tcp */
DNAT       tcp  --  anywhere             anywhere             /* default/kubernetes:dns-tcp */ recent: SET name: KUBE-SEP-YWHP6BFRXNFGEHLX side: source mask: 255.255.255.255 tcp to:172.29.245.70:8053

Chain KUBE-SERVICES (2 references)
target     prot opt source               destination
KUBE-SVC-4JCRTMMYZAAYMIJ2  tcp  --  anywhere             ip-192-168-131-84.us-west-2.compute.internal  /* default/router:1936-tcp cluster IP */ tcp dpt:jetcmeserver
KUBE-SVC-ECTPRXTXBM34L34Q  tcp  --  anywhere             ip-192-168-185-164.us-west-2.compute.internal  /* default/docker-registry:5000-tcp cluster IP */ tcp dpt:commplex-main
KUBE-SVC-NPX46M4PTMTKRN6Y  tcp  --  anywhere             ip-192-168-0-1.us-west-2.compute.internal  /* default/kubernetes:https cluster IP */ tcp dpt:https
KUBE-SVC-3VQ6B3MLH7E2SZT4  udp  --  anywhere             ip-192-168-0-1.us-west-2.compute.internal  /* default/kubernetes:dns cluster IP */ udp dpt:domain
KUBE-SVC-BA6I5HTZKAAAJT56  tcp  --  anywhere             ip-192-168-0-1.us-west-2.compute.internal  /* default/kubernetes:dns-tcp cluster IP */ tcp dpt:domain
KUBE-SVC-GQKZAHCS5DTMHUQ6  tcp  --  anywhere             ip-192-168-131-84.us-west-2.compute.internal  /* default/router:80-tcp cluster IP */ tcp dpt:http
KUBE-SVC-IKV43KYNCXS2W7KZ  tcp  --  anywhere             ip-192-168-131-84.us-west-2.compute.internal  /* default/router:443-tcp cluster IP */ tcp dpt:https
KUBE-NODEPORTS  all  --  anywhere             anywhere             /* kubernetes service nodeports; NOTE: this must be the last rule in this chain */ ADDRTYPE match dst-type LOCAL

Chain KUBE-SVC-3VQ6B3MLH7E2SZT4 (1 references)
target     prot opt source               destination
KUBE-SEP-R2XQMTWJG4WFM36Q  all  --  anywhere             anywhere             /* default/kubernetes:dns */ recent: CHECK seconds: 180 reap name: KUBE-SEP-R2XQMTWJG4WFM36Q side: source mask: 255.255.255.255
KUBE-SEP-PXYIPIRGKMCKHQQ6  all  --  anywhere             anywhere             /* default/kubernetes:dns */ recent: CHECK seconds: 180 reap name: KUBE-SEP-PXYIPIRGKMCKHQQ6 side: source mask: 255.255.255.255
KUBE-SEP-NALPWJLJVSZNTJRD  all  --  anywhere             anywhere             /* default/kubernetes:dns */ recent: CHECK seconds: 180 reap name: KUBE-SEP-NALPWJLJVSZNTJRD side: source mask: 255.255.255.255
KUBE-SEP-R2XQMTWJG4WFM36Q  all  --  anywhere             anywhere             /* default/kubernetes:dns */ statistic mode random probability 0.33332999982
KUBE-SEP-PXYIPIRGKMCKHQQ6  all  --  anywhere             anywhere             /* default/kubernetes:dns */ statistic mode random probability 0.50000000000
KUBE-SEP-NALPWJLJVSZNTJRD  all  --  anywhere             anywhere             /* default/kubernetes:dns */

Chain KUBE-SVC-4JCRTMMYZAAYMIJ2 (1 references)
target     prot opt source               destination
KUBE-SEP-MMFG5XZSCW3A7WLN  all  --  anywhere             anywhere             /* default/router:1936-tcp */ statistic mode random probability 0.33332999982
KUBE-SEP-FYJ6WLFNFEAB7O3Q  all  --  anywhere             anywhere             /* default/router:1936-tcp */ statistic mode random probability 0.50000000000
KUBE-SEP-IXIDMSKLF33PGFQD  all  --  anywhere             anywhere             /* default/router:1936-tcp */

Chain KUBE-SVC-BA6I5HTZKAAAJT56 (1 references)
target     prot opt source               destination
KUBE-SEP-NPQ2VIAEH3BD3ESR  all  --  anywhere             anywhere             /* default/kubernetes:dns-tcp */ recent: CHECK seconds: 180 reap name: KUBE-SEP-NPQ2VIAEH3BD3ESR side: source mask: 255.255.255.255
KUBE-SEP-SDV4BXWKC6E2WZAP  all  --  anywhere             anywhere             /* default/kubernetes:dns-tcp */ recent: CHECK seconds: 180 reap name: KUBE-SEP-SDV4BXWKC6E2WZAP side: source mask: 255.255.255.255
KUBE-SEP-YWHP6BFRXNFGEHLX  all  --  anywhere             anywhere             /* default/kubernetes:dns-tcp */ recent: CHECK seconds: 180 reap name: KUBE-SEP-YWHP6BFRXNFGEHLX side: source mask: 255.255.255.255
KUBE-SEP-NPQ2VIAEH3BD3ESR  all  --  anywhere             anywhere             /* default/kubernetes:dns-tcp */ statistic mode random probability 0.33332999982
KUBE-SEP-SDV4BXWKC6E2WZAP  all  --  anywhere             anywhere             /* default/kubernetes:dns-tcp */ statistic mode random probability 0.50000000000
KUBE-SEP-YWHP6BFRXNFGEHLX  all  --  anywhere             anywhere             /* default/kubernetes:dns-tcp */

Chain KUBE-SVC-ECTPRXTXBM34L34Q (1 references)
target     prot opt source               destination
KUBE-SEP-O5ROI2O3K6SCVUFM  all  --  anywhere             anywhere             /* default/docker-registry:5000-tcp */ recent: CHECK seconds: 180 reap name: KUBE-SEP-O5ROI2O3K6SCVUFM side: source mask: 255.255.255.255
KUBE-SEP-O5ROI2O3K6SCVUFM  all  --  anywhere             anywhere             /* default/docker-registry:5000-tcp */

Chain KUBE-SVC-GQKZAHCS5DTMHUQ6 (1 references)
target     prot opt source               destination
KUBE-SEP-T4RPTTFRMYR2YTCF  all  --  anywhere             anywhere             /* default/router:80-tcp */ statistic mode random probability 0.33332999982
KUBE-SEP-CMBITXRDYAFP2SEQ  all  --  anywhere             anywhere             /* default/router:80-tcp */ statistic mode random probability 0.50000000000
KUBE-SEP-BSCAUFMAF3NDXQD7  all  --  anywhere             anywhere             /* default/router:80-tcp */

Chain KUBE-SVC-IKV43KYNCXS2W7KZ (1 references)
target     prot opt source               destination
KUBE-SEP-MYMUKV3LVCJ5D7KK  all  --  anywhere             anywhere             /* default/router:443-tcp */ statistic mode random probability 0.33332999982
KUBE-SEP-6X4724UNGY2RWB6P  all  --  anywhere             anywhere             /* default/router:443-tcp */ statistic mode random probability 0.50000000000
KUBE-SEP-GF3KZOOMRL5JX7AC  all  --  anywhere             anywhere             /* default/router:443-tcp */

Chain KUBE-SVC-NPX46M4PTMTKRN6Y (1 references)
target     prot opt source               destination
KUBE-SEP-BDR254MFJVTUOIYH  all  --  anywhere             anywhere             /* default/kubernetes:https */ recent: CHECK seconds: 180 reap name: KUBE-SEP-BDR254MFJVTUOIYH side: source mask: 255.255.255.255
KUBE-SEP-J6XRA6J4L6J6DN7P  all  --  anywhere             anywhere             /* default/kubernetes:https */ recent: CHECK seconds: 180 reap name: KUBE-SEP-J6XRA6J4L6J6DN7P side: source mask: 255.255.255.255
KUBE-SEP-V7MSHVHABU7ZBXRH  all  --  anywhere             anywhere             /* default/kubernetes:https */ recent: CHECK seconds: 180 reap name: KUBE-SEP-V7MSHVHABU7ZBXRH side: source mask: 255.255.255.255
KUBE-SEP-BDR254MFJVTUOIYH  all  --  anywhere             anywhere             /* default/kubernetes:https */ statistic mode random probability 0.33332999982
KUBE-SEP-J6XRA6J4L6J6DN7P  all  --  anywhere             anywhere             /* default/kubernetes:https */ statistic mode random probability 0.50000000000
KUBE-SEP-V7MSHVHABU7ZBXRH  all  --  anywhere             anywhere             /* default/kubernetes:https */
```
##################################################
Something interesting was when running the debug script it gave me the following errors
```
Analyzing master
Error from server: nodes "i-01a29a0586cc3e094" not found
Node i-01a29a0586cc3e094: no IP address in OpenShift
Error from server: nodes "i-09e1d77ee3928ba8f" not found
Node i-09e1d77ee3928ba8f: no IP address in OpenShift
Error from server: nodes "i-0ac6f7c12f5a197b3" not found
Node i-0ac6f7c12f5a197b3: no IP address in OpenShift
Error from server: nodes "i-076229e4e22c7851f" not found
Node i-076229e4e22c7851f: no IP address in OpenShift
Error from server: nodes "i-0732ef1f42e67ad98" not found
Node i-0732ef1f42e67ad98: no IP address in OpenShift
Error from server: nodes "i-087aeac652329f085" not found
Node i-087aeac652329f085: no IP address in OpenShift
Error from server: nodes "i-0310b59bf6e9178ac" not found
Node i-0310b59bf6e9178ac: no IP address in OpenShift
Error from server: nodes "i-01704b693047fd2ef" not found
Node i-01704b693047fd2ef: no IP address in OpenShift
Error from server: nodes "i-093b0035c8d054e33" not found
Node i-093b0035c8d054e33: no IP address in OpenShift

Analyzing ip-172-29-244-200.us-west-2.compute.internal (172.29.244.200)
No pods on ip-172-29-244-200.us-west-2.compute.internal, so no connectivity tests

Output is in openshift-sdn-debug-2017-06-16.tgz
```

**Comment by xxwassyxx** [comment]
Doing a little more digging I believe I am actually running into some sort of dns issue. Since i have 3 infra nodes and haproxy on the 2 nodes that dont have the docker registry are getting a no route to host when checking docker, I ran a tcpdump on tun0 since thats what the flow appeared to be. 

```
# ip link add name snooper0 type dummy
# ip link set dev snooper0 up
# ovs-vsctl add-port br0 snooper0
# ovs-vsctl -- set Bridge br0 mirrors=@m  -- --id=@snooper0 \
  get Port snooper0  -- --id=@tun0 get Port tun0 \
  -- --id=@m create Mirror name=mymirror select-dst-port=@tun0 \
  select-src-port=@tun0 output-port=@snooper0 select_all=1
# tcpdump -ttttnnvvS -i snooper0
tcpdump: WARNING: snooper0: no IPv4 address assigned
tcpdump: listening on snooper0, link-type EN10MB (Ethernet), capture size 65535 bytes
2017-06-17 23:01:31.051632 ARP, Ethernet (len 6), IPv4 (len 4), Request who-has 10.129.0.2 tell 10.131.0.1, length 28
2017-06-17 23:01:32.053631 ARP, Ethernet (len 6), IPv4 (len 4), Request who-has 10.129.0.2 tell 10.131.0.1, length 28
2017-06-17 23:01:33.055665 ARP, Ethernet (len 6), IPv4 (len 4), Request who-has 10.129.0.2 tell 10.131.0.1, length 28
2017-06-17 23:01:34.057630 ARP, Ethernet (len 6), IPv4 (len 4), Request who-has 10.129.0.2 tell 10.131.0.1, length 28
2017-06-17 23:01:35.059627 ARP, Ethernet (len 6), IPv4 (len 4), Request who-has 10.129.0.2 tell 10.131.0.1, length 28
2017-06-17 23:01:38.057424 ARP, Ethernet (len 6), IPv4 (len 4), Request who-has 10.129.0.2 tell 10.131.0.1, length 28
```

**Comment by xxwassyxx** [comment]
Looks like openvswitch is indeed doing what its meant to according to its rules tho.
```
# ovs-appctl ofproto/trace br0 in_port=2,tcp,nw_dst=10.129.0.2,tcp_dst=5000
Bridge: br0
Flow: tcp,in_port=2,vlan_tci=0x0000,dl_src=00:00:00:00:00:00,dl_dst=00:00:00:00:00:00,nw_src=0.0.0.0,nw_dst=10.129.0.2,nw_tos=0,nw_ecn=0,nw_ttl=0,tp_src=0,tp_dst=5000,tcp_flags=0

Rule: table=0 cookie=0 priority=200,ip,in_port=2
OpenFlow actions=goto_table:5

	Resubmitted flow: tcp,in_port=2,vlan_tci=0x0000,dl_src=00:00:00:00:00:00,dl_dst=00:00:00:00:00:00,nw_src=0.0.0.0,nw_dst=10.129.0.2,nw_tos=0,nw_ecn=0,nw_ttl=0,tp_src=0,tp_dst=5000,tcp_flags=0
	Resubmitted regs: reg0=0x0 reg1=0x0 reg2=0x0 reg3=0x0 reg4=0x0 reg5=0x0 reg6=0x0 reg7=0x0 reg8=0x0 reg9=0x0 reg10=0x0 reg11=0x0 reg12=0x0 reg13=0x0 reg14=0x0 reg15=0x0
	Resubmitted  odp: drop
	Resubmitted megaflow: recirc_id=0,ip,in_port=2,nw_dst=10.128.0.0/15,nw_frag=no
	Rule: table=5 cookie=0 priority=100,ip,nw_dst=10.128.0.0/14
	OpenFlow actions=goto_table:8

		Resubmitted flow: unchanged
		Resubmitted regs: reg0=0x0 reg1=0x0 reg2=0x0 reg3=0x0 reg4=0x0 reg5=0x0 reg6=0x0 reg7=0x0 reg8=0x0 reg9=0x0 reg10=0x0 reg11=0x0 reg12=0x0 reg13=0x0 reg14=0x0 reg15=0x0
		Resubmitted  odp: drop
		Resubmitted megaflow: recirc_id=0,ip,in_port=2,nw_dst=10.129.0.0/23,nw_frag=no
		Rule: table=8 cookie=0 priority=100,ip,nw_dst=10.129.0.0/23
		OpenFlow actions=move:NXM_NX_REG0[]->NXM_NX_TUN_ID[0..31],set_field:172.29.246.150->tun_dst,output:1
		output to kernel tunnel

Final flow: tcp,tun_src=0.0.0.0,tun_dst=172.29.246.150,tun_ipv6_src=::,tun_ipv6_dst=::,tun_gbp_id=0,tun_gbp_flags=0,tun_tos=0,tun_ttl=0,tun_flags=0,in_port=2,vlan_tci=0x0000,dl_src=00:00:00:00:00:00,dl_dst=00:00:00:00:00:00,nw_src=0.0.0.0,nw_dst=10.129.0.2,nw_tos=0,nw_ecn=0,nw_ttl=0,tp_src=0,tp_dst=5000,tcp_flags=0
Megaflow: recirc_id=0,ip,tun_id=0/0xffffffff,tun_dst=0.0.0.0,in_port=2,nw_dst=10.129.0.0/23,nw_ecn=0,nw_frag=no
Datapath actions: set(tunnel(tun_id=0x0,dst=172.29.246.150,ttl=64,flags(df|key))),2
```

**Comment by xxwassyxx** [comment]
This can be closed. Stupidity on my part. had the security group for port 4789 as tcp instead of udp....
