### ISSUE TITLE
tcp resets initiated by openshift-node

### ISSUE THREAD

**Issue by jeremyeder** [openshift/origin#5106]
We have noted an excessive number of tcp connection RST packets when using openshift 3.0 to port 8443 on the master.  On a 100 node cluster, ~20 RST's per second (according to tcpdump on the master).

If I stop the openshift-node processes, the resets go away.  There are connection resets even within a single VM that has both openshift-master and openshift-node running (just wanted to verify it wasn't load-related, EC2 related or sdn).  Wasn't able to find any reference to this in google-containers mailing list or kubernetes github issues.

To reproduce this, I'm using RHEL7.2 in EC2 and OpenShift 3.0.900, installed with openshift-ansible.
You can either profile using pprof or just look at ```netstat -s|grep reset```

This profile was taken on the master of a 100 node cluster.  I let it run for about 25 minutes.
```
(pprof) top10000 -cum
1201.47s of 1487.59s total (80.77%)
Dropped 1947 nodes (cum <= 7.44s)
      flat  flat%   sum%        cum   cum%
     0.01s 0.00067% 0.00067%   1238.11s 83.23%  runtime.goexit
     0.07s 0.0047% 0.0054%    976.03s 65.61%  crypto/tls.(*Conn).Handshake
     0.10s 0.0067% 0.012%    755.21s 50.77%  net/http.(*conn).serve
     0.04s 0.0027% 0.015%    693.91s 46.65%  crypto/rsa.SignPKCS1v15
     0.07s 0.0047% 0.019%    693.71s 46.63%  crypto/rsa.decrypt
     0.25s 0.017% 0.036%    640.78s 43.08%  math/big.nat.expNN
     0.05s 0.0034%  0.04%    639.68s 43.00%  math/big.(*Int).Exp
     0.01s 0.00067%  0.04%    618.90s 41.60%  crypto/tls.(*Conn).serverHandshake
     0.02s 0.0013% 0.042%    614.45s 41.31%  crypto/tls.(*serverHandshakeState).doFullHandshake
     4.21s  0.28%  0.32%    596.06s 40.07%  math/big.nat.expNNWindowed
     4.70s  0.32%  0.64%    501.48s 33.71%  math/big.nat.div
   120.26s  8.08%  8.72%    494.64s 33.25%  math/big.nat.divLarge
     0.03s 0.002%  8.73%    487.08s 32.74%  crypto/tls.(*ecdheKeyAgreement).generateServerKeyExchange
     0.01s 0.00067%  8.73%    356.75s 23.98%  net/http.func·022
     0.03s 0.002%  8.73%    356.71s 23.98%  crypto/tls.(*Conn).clientHandshake
     0.09s 0.0061%  8.74%    354.18s 23.81%  crypto/tls.(*clientHandshakeState).doFullHandshake
         0     0%  8.74%    244.64s 16.45%  crypto/rsa.(*PrivateKey).Sign
```

**Comment by jeremyeder** [comment]
@derekwaynecarr @smarterclayton

**Comment by sdodson** [comment]
The version Jeremy is using is built from origin 98b3c2967831a3a336cfc18c8eac055ea817e10a

**Comment by smarterclayton** [comment]
Are we sure the connection being reset is originating from the node?  Can
we check that?

**Comment by jeremyeder** [comment]
Yes; master is 172.31.37.122.

```121   0.831549 172.31.7.179 -> 172.31.37.122 TCP 60 37770→8443 [RST] Seq=33 Win=0 Len=0```

**Comment by smarterclayton** [comment]
Ok, so we know it's the node.  It's something probably using an origin
client.  I don't know how to isolate it further without turning up logging
on the master or the node.  We can do a review of the node code and ensure
everyone is using the correct transports.  Is there something between the
node and master that could cause this?  SDN?  Firewalls? Outgoing firewalls
on the node?

**Comment by sdodson** [comment]
That's a service ip right, does the kube-proxy nuke the connection
aggressively?

**Comment by smarterclayton** [comment]
Is it a service IP?

**Comment by jeremyeder** [comment]
172.31.37.122 is the IP of eth0 on the master.

**Comment by jeremyeder** [comment]
There are resets even on the loopback interface.  All related to ports 8443 and 4001.
Only openshift-master service is running here:

```
# tcpdump -ilo -n -v -w loopback.pcap
$ tshark -r loopback.pcap -Y '(tcp.stream eq 40)'
 79   0.357050 172.31.52.145 -> 172.31.52.145 TCP 97 58201→8443 [PSH, ACK] Seq=1 Ack=1 Win=1438 Len=31 TSval=11362259 TSecr=11352260
 81   0.357145 172.31.52.145 -> 172.31.52.145 TCP 66 58201→8443 [FIN, ACK] Seq=32 Ack=1 Win=1438 Len=0 TSval=11362259 TSecr=11352260
 87   0.357326 172.31.52.145 -> 172.31.52.145 TCP 100 8443→58201 [PSH, ACK] Seq=1 Ack=33 Win=400 Len=34 TSval=11362259 TSecr=11362259
 90   0.357362 172.31.52.145 -> 172.31.52.145 TCP 54 58201→8443 [RST] Seq=33 Win=0 Len=0
```

Here's one for etcd
```
$ tshark -r loopback.pcap -Y '(tcp.stream eq 42)'
 89   0.357337 172.31.52.145 -> 172.31.52.145 TCP 97 42798→4001 [PSH, ACK] Seq=1 Ack=1 Win=1463 Len=31 TSval=11362259 TSecr=11361294
 93   0.357419 172.31.52.145 -> 172.31.52.145 TCP 66 42798→4001 [FIN, ACK] Seq=32 Ack=1 Win=1463 Len=0 TSval=11362259 TSecr=11361294
 94   0.357419 172.31.52.145 -> 172.31.52.145 TCP 100 4001→42798 [PSH, ACK] Seq=1 Ack=32 Win=410 Len=34 TSval=11362259 TSecr=11362259
 98   0.357440 172.31.52.145 -> 172.31.52.145 TCP 54 42798→4001 [RST] Seq=32 Win=0 Len=0
100   0.357448 172.31.52.145 -> 172.31.52.145 TCP 66 4001→42798 [ACK] Seq=35 Ack=33 Win=410 Len=0 TSval=11362259 TSecr=11362259
103   0.357453 172.31.52.145 -> 172.31.52.145 TCP 54 42798→4001 [RST] Seq=33 Win=0 Len=0
104   0.357457 172.31.52.145 -> 172.31.52.145 TCP 97 4001→42798 [PSH, ACK] Seq=35 Ack=33 Win=410 Len=31 TSval=11362259 TSecr=11362259
105   0.357465 172.31.52.145 -> 172.31.52.145 TCP 54 42798→4001 [RST] Seq=33 Win=0 Len=0
```

If I turn off all the openshift services and just run some traffic between machines, there are no resets.

**Comment by ncdc** [comment]
I see resets with pure upstream kube as well, so I doubt it's origin-specific.

**Comment by smarterclayton** [comment]
I think it's Jordan's TLS caching.  :)

**Comment by liggitt** [comment]
> I think it's Jordan's TLS caching. :)

I can't tell if you're serious or not

**Comment by ncdc** [comment]
Using this test program (https://gist.github.com/ncdc/f5929ac981c89d1cc4b8), I see the following deltas every time the Reflector's resyncPeriod elapses, causing the watch to stop, a full list to be reretrieved, and a new watch to start:

+1 conn resets received
+2 conn resets sent
+1 conns reset due to unexpected data

**Comment by ncdc** [comment]
netstat invocation: `watch -n1 -d "netstat -s|grep reset"`

**Comment by ncdc** [comment]
Additional info on how watch affects resets: https://gist.github.com/ncdc/b545750e4195cefd0c13

**Comment by ncdc** [comment]
Upstream issue: https://github.com/kubernetes/kubernetes/issues/15664

**Comment by smarterclayton** [comment]
Jeremy are you still CPU bound?

On Oct 14, 2015, at 5:12 PM, Andy Goldstein <notifications@github.com>
wrote:

Upstream issue: kubernetes/kubernetes#15664
<https://github.com/kubernetes/kubernetes/issues/15664>

—
Reply to this email directly or view it on GitHub
<https://github.com/openshift/origin/issues/5106#issuecomment-148201891>.

**Comment by jeremyeder** [comment]
With 4 cores in the master, I found it pretty much limited to 100 nodes (see pprof from first comment in this issue).  Even 100 was sketchy -- sometimes a handful of nodes would show "NotReady".  I threw more cores at it, so it's not CPU bound (today).

Here is a chart of cpu utilization on a 16 core master of a 250 node cluster.  Look at the 04:06:50 mark in the graph - the openshift-master process is putting 85% load on all 16 cores. This cluster has zero pods.

![cpu_all_cpu_busy](https://cloud.githubusercontent.com/assets/1919640/10501007/1f0ee24a-72ab-11e5-8740-644b2b973e35.png)

**Comment by smarterclayton** [comment]
What interval is that?  30seconds?  Or 30 minutes?

**Comment by jeremyeder** [comment]
Seconds -- the graph is 300 seconds long in total, with a sampling interval of every 3-seconds.

**Comment by smarterclayton** [comment]
Oh wow - the proxy has a resync interval of 30 seconds.

**Comment by smarterclayton** [comment]
That's getting fixed now...

**Comment by smarterclayton** [comment]
Opened https://github.com/kubernetes/kubernetes/pull/15682 which changes
that to 10 minutes - that'll space this out some.

**Comment by smarterclayton** [comment]
Added https://github.com/kubernetes/kubernetes/issues/15683 to introduce
jitter to avoid this sort of synchronization.

**Comment by smarterclayton** [comment]
Spawned #5135 for TLS session ticket resumption.

**Comment by jeremyeder** [comment]
@smarterclayton we want https://github.com/kubernetes/kubernetes/pull/15682 in ose3.1.

**Comment by jeremyeder** [comment]
@smarterclayton And also https://github.com/kubernetes/kubernetes/issues/15683 but that's not merged into kube yet.

**Comment by ncdc** [comment]
@jeremyeder the origin equiv to 15682 is #5142

**Comment by smarterclayton** [comment]
This is in
